{
  "split": "targeted",
  "category": "plain",
  "sourceLanguage": "en",
  "targetLanguage": "es",
  "contentType": "text",
  "source": {
    "text": "No pages have been translated yet. Start with the dashboard."
  },
  "references": [
    {
      "quality": "primary",
      "text": "Aún no se ha traducido ninguna página. Empiece con el panel.",
      "notes": "First-party dev reference for plain onboarding copy."
    }
  ],
  "checks": {
    "sourceShouldChange": true,
    "expectedPatterns": ["(?i)\\b(página|panel|traducido)\\b"]
  },
  "provenance": {
    "sourceClass": "first_party_authored",
    "authorId": "team-evals",
    "createdAt": "2026-04-28",
    "sourceOrigin": "private-eval-spec BF-EVAL-TXT-001",
    "derivedFrom": null,
    "publicExposure": "private",
    "reviewStatus": "technical_reviewed",
    "referenceTranslatorId": "evals-translator-es",
    "referenceReviewerId": "evals-reviewer-es",
    "referenceReviewDate": "2026-04-28",
    "technicalReviewerId": "team-evals",
    "technicalReviewDate": "2026-04-28",
    "notes": "Dev plain-text case authored for phase-1 basics coverage."
  }
}
