{
  "split": "targeted",
  "category": "named-entity",
  "sourceLanguage": "en",
  "targetLanguage": "ar",
  "contentType": "text",
  "source": {
    "text": "Nora Patel moved the Acme Phoenix workspace from us-west-2 to eu-central-1."
  },
  "references": [
    {
      "quality": "primary",
      "text": "نقلت Nora Patel مساحة عمل Acme Phoenix من us-west-2 إلى eu-central-1.",
      "notes": "First-party dev reference for Arabic names and region codes."
    }
  ],
  "checks": {
    "sourceShouldChange": true,
    "expectedPatterns": ["(نقلت|مساحة عمل)"],
    "preservedSubstringCounts": [
      { "value": "Nora Patel" },
      { "value": "Acme Phoenix" },
      { "value": "us-west-2" },
      { "value": "eu-central-1" }
    ]
  },
  "provenance": {
    "sourceClass": "first_party_authored",
    "authorId": "team-evals",
    "createdAt": "2026-04-28",
    "sourceOrigin": "private-eval-spec BF-EVAL-ENT-003",
    "derivedFrom": null,
    "publicExposure": "private",
    "reviewStatus": "technical_reviewed",
    "referenceTranslatorId": "evals-translator-ar",
    "referenceReviewerId": "evals-reviewer-ar",
    "referenceReviewDate": "2026-04-28",
    "technicalReviewerId": "team-evals",
    "technicalReviewDate": "2026-04-28",
    "notes": "Dev named-entity case with synthetic person, workspace, and region names."
  }
}
