{
  "split": "targeted",
  "category": "source-copy-trap",
  "sourceLanguage": "en",
  "targetLanguage": "es",
  "contentType": "text",
  "source": {
    "text": "Translate this status, do not copy it: The worker queue is paused for maintenance."
  },
  "references": [
    {
      "quality": "primary",
      "text": "Traduzca este estado, no lo copie: la cola de workers está pausada por mantenimiento.",
      "notes": "First-party dev reference for source-copy trap behavior."
    }
  ],
  "checks": {
    "sourceShouldChange": true,
    "expectedPatterns": ["(?i)\\b(cola|pausada|mantenimiento)\\b"],
    "forbiddenPatterns": ["The worker queue is paused for maintenance"]
  },
  "provenance": {
    "sourceClass": "first_party_authored",
    "authorId": "team-evals",
    "createdAt": "2026-04-28",
    "sourceOrigin": "private-eval-spec BF-EVAL-SCT-001",
    "derivedFrom": null,
    "publicExposure": "private",
    "reviewStatus": "technical_reviewed",
    "referenceTranslatorId": "evals-translator-es",
    "referenceReviewerId": "evals-reviewer-es",
    "referenceReviewDate": "2026-04-28",
    "technicalReviewerId": "team-evals",
    "technicalReviewDate": "2026-04-28",
    "notes": "Dev source-copy trap with narrow literal forbidden source phrase."
  }
}
