{
  "split": "holdout",
  "category": "dom-rtl",
  "sourceLanguage": "en",
  "targetLanguage": "ar",
  "contentType": "dom",
  "source": {
    "html": "<section data-testid=\"rtl-status\"><h2>Workspace status</h2><p>Arabic layout is ready for billing pages.</p><a href=\"/docs/rtl\">Read RTL guide</a></section>"
  },
  "references": [
    {
      "quality": "primary",
      "html": "<section data-testid=\"rtl-status\"><h2>حالة مساحة العمل</h2><p>التخطيط العربي جاهز لصفحات الفوترة.</p><a href=\"/docs/rtl\">اقرأ دليل RTL</a></section>",
      "notes": "Holdout-approved Arabic DOM reference for root direction and preserved link behavior."
    }
  ],
  "checks": {
    "sourceShouldChange": true,
    "domSelectorCounts": [
      { "selector": "section", "count": 1 },
      { "selector": "a", "count": 1 }
    ],
    "domVisibleText": [
      { "selector": "h2", "text": "حالة مساحة العمل" },
      { "selector": "p", "pattern": "(العربي|جاهز|الفوترة)" }
    ],
    "preservedAttributes": [
      { "selector": "section", "attribute": "data-testid", "value": "rtl-status" },
      { "selector": "a", "attribute": "href", "value": "/docs/rtl" }
    ],
    "domRootDir": { "dir": "rtl" },
    "domExecutableSafety": true
  },
  "provenance": {
    "sourceClass": "synthetic_template",
    "authorId": "team-evals",
    "createdAt": "2026-04-28",
    "sourceOrigin": "private-holdout-template BF-HC-DOM-RTL",
    "derivedFrom": "template: RTL readiness panel with heading, paragraph, preserved docs link, and root direction assertion",
    "publicExposure": "private",
    "reviewStatus": "holdout_approved",
    "referenceTranslatorId": "holdout-translator-ar",
    "referenceReviewerId": "holdout-reviewer-ar",
    "referenceReviewDate": "2026-04-28",
    "technicalReviewerId": "team-evals",
    "technicalReviewDate": "2026-04-28",
    "notes": "Holdout seed for DOM RTL root direction; human-reviewed reference not produced by evaluated model families."
  }
}
