{
  "split": "targeted",
  "category": "markdown",
  "sourceLanguage": "en",
  "targetLanguage": "ar",
  "contentType": "markdown",
  "source": {
    "text": "> Note: keep `babulfish.config.ts` beside the app entry.\n\nSee [configuration](/docs/configuration) before shipping."
  },
  "references": [
    {
      "quality": "primary",
      "text": "> ملاحظة: أبقِ `babulfish.config.ts` بجانب نقطة دخول التطبيق.\n\nراجع [الإعدادات](/docs/configuration) قبل الشحن.",
      "notes": "First-party dev reference for Arabic blockquote and link preservation."
    }
  ],
  "checks": {
    "sourceShouldChange": true,
    "preservedSubstringCounts": [
      { "value": "babulfish.config.ts" }
    ],
    "markdownStructure": {
      "blockquotes": 1,
      "inlineCode": { "count": 1, "texts": ["babulfish.config.ts"] },
      "links": { "count": 1, "labels": ["الإعدادات"], "hrefs": ["/docs/configuration"] }
    }
  },
  "provenance": {
    "sourceClass": "first_party_authored",
    "authorId": "team-evals",
    "createdAt": "2026-04-28",
    "sourceOrigin": "private-eval-spec BF-EVAL-MD-012",
    "derivedFrom": null,
    "publicExposure": "private",
    "reviewStatus": "technical_reviewed",
    "referenceTranslatorId": "evals-translator-ar",
    "referenceReviewerId": "evals-reviewer-ar",
    "referenceReviewDate": "2026-04-28",
    "technicalReviewerId": "team-evals",
    "technicalReviewDate": "2026-04-28",
    "notes": "Dev markdown case authored for Arabic blockquote coverage."
  }
}
