{
  "split": "targeted",
  "category": "dom-attrs",
  "sourceLanguage": "en",
  "targetLanguage": "fr",
  "contentType": "dom",
  "source": {
    "html": "<button id=\"save-button\" data-action=\"save\" title=\"Save changes\" aria-label=\"Save changes\">Save</button>"
  },
  "references": [
    {
      "quality": "primary",
      "html": "<button id=\"save-button\" data-action=\"save\" title=\"Enregistrer les modifications\" aria-label=\"Enregistrer les modifications\">Enregistrer</button>",
      "notes": "Product-derived dev reference for translated button attributes."
    }
  ],
  "checks": {
    "sourceShouldChange": true,
    "domVisibleText": [
      { "selector": "button", "text": "Enregistrer" }
    ],
    "preservedAttributes": [
      { "selector": "button", "attribute": "id", "value": "save-button" },
      { "selector": "button", "attribute": "data-action", "value": "save" }
    ],
    "translatedAttributes": [
      { "selector": "button", "attribute": "title", "expectedPattern": "(?i)enregistrer" },
      { "selector": "button", "attribute": "aria-label", "expectedPattern": "(?i)enregistrer" }
    ],
    "domExecutableSafety": true
  },
  "runner": {
    "dom": {
      "translateAttributes": ["title", "aria-label"]
    }
  },
  "provenance": {
    "sourceClass": "product_derived_rewrite",
    "authorId": "team-evals",
    "createdAt": "2026-04-28",
    "sourceOrigin": "private-product-screen BF-DOM-ACTIONS",
    "derivedFrom": "rewritten from first-party action button into synthetic eval content",
    "publicExposure": "private",
    "reviewStatus": "technical_reviewed",
    "referenceTranslatorId": "evals-translator-fr",
    "referenceReviewerId": "evals-reviewer-fr",
    "referenceReviewDate": "2026-04-28",
    "technicalReviewerId": "team-evals",
    "technicalReviewDate": "2026-04-28",
    "notes": "Dev DOM attrs case for translated title and aria-label plus preserved IDs."
  }
}
