{
  "split": "targeted",
  "category": "markdown",
  "sourceLanguage": "en",
  "targetLanguage": "es",
  "contentType": "markdown",
  "source": {
    "text": "## Runtime update\n\n- Keep `WebGPU` enabled.\n- Read the [runtime guide](/docs/runtime).\n- Restart babulfish after changing models."
  },
  "references": [
    {
      "quality": "primary",
      "text": "## Actualización del entorno de ejecución\n\n- Mantenga `WebGPU` activado.\n- Lea la [guía de ejecución](/docs/runtime).\n- Reinicie babulfish después de cambiar modelos.",
      "notes": "First-party dev reference for markdown structure and preservation."
    }
  ],
  "checks": {
    "sourceShouldChange": true,
    "preservedSubstringCounts": [
      { "value": "WebGPU" },
      { "value": "babulfish" }
    ],
    "markdownStructure": {
      "headings": [{ "level": 2, "count": 1 }],
      "unorderedListItems": 3,
      "inlineCode": { "count": 1, "texts": ["WebGPU"] },
      "links": { "count": 1, "labels": ["guía de ejecución"], "hrefs": ["/docs/runtime"] }
    }
  },
  "provenance": {
    "sourceClass": "first_party_authored",
    "authorId": "team-evals",
    "createdAt": "2026-04-28",
    "sourceOrigin": "private-eval-spec BF-EVAL-MD-001",
    "derivedFrom": null,
    "publicExposure": "private",
    "reviewStatus": "technical_reviewed",
    "referenceTranslatorId": "evals-translator-es",
    "referenceReviewerId": "evals-reviewer-es",
    "referenceReviewDate": "2026-04-28",
    "technicalReviewerId": "team-evals",
    "technicalReviewDate": "2026-04-28",
    "notes": "Dev markdown case authored for release-note list coverage."
  }
}
