{
  "split": "general",
  "category": "technical-docs",
  "sourceLanguage": "en",
  "targetLanguage": "es",
  "contentType": "markdown",
  "source": {
    "text": "To use WebGPU in your application, you need to implement a `TranslatorProvider` that handles shader translation and device initialization."
  },
  "references": [
    {
      "quality": "primary",
      "text": "Para usar WebGPU en su aplicaciĂ³n, debe implementar un `TranslatorProvider` que maneje la traducciĂ³n de sombreadores y la inicializaciĂ³n del dispositivo.",
      "notes": "Human-review required before holdout use."
    }
  ],
  "checks": {
    "sourceShouldChange": true,
    "expectedPatterns": [
      "(?i)\\b(aplicaciĂ³n|traducciĂ³n|inicializaciĂ³n|dispositivo)\\b"
    ],
    "forbiddenPatterns": [
      "(?i)<think>",
      "(?i)</think>",
      "```",
      "(?i)^\\s*(translation|answer|reference)\\s*:",
      "(?i)sourceLanguage",
      "(?i)targetLanguage",
      "(?i)system prompt"
    ],
    "preservedSubstrings": [
      "WebGPU",
      "`TranslatorProvider`"
    ],
    "markdownMarkers": [
      "`"
    ]
  }
}
