{
  "split": "holdout",
  "category": "preservation",
  "sourceLanguage": "fr",
  "targetLanguage": "en",
  "contentType": "text",
  "source": {
    "text": "Envoyez {{ticketId}} vers /support/escalations avant le gel 2026-06-30."
  },
  "references": [
    {
      "quality": "primary",
      "text": "Send {{ticketId}} to /support/escalations before the 2026-06-30 freeze.",
      "notes": "Holdout-approved English reference preserving placeholder, route, and date."
    }
  ],
  "checks": {
    "sourceShouldChange": true,
    "expectedPatterns": ["(?i)(send|before|freeze)"],
    "preservedSubstringCounts": [
      { "value": "{{ticketId}}" },
      { "value": "/support/escalations" },
      { "value": "2026-06-30" }
    ]
  },
  "provenance": {
    "sourceClass": "synthetic_template",
    "authorId": "team-evals",
    "createdAt": "2026-04-28",
    "sourceOrigin": "private-holdout-template BF-HC-TEXT-004",
    "derivedFrom": "template: support escalation sentence with placeholder, route path, and ISO date",
    "publicExposure": "private",
    "reviewStatus": "holdout_approved",
    "referenceTranslatorId": "holdout-translator-en",
    "referenceReviewerId": "holdout-reviewer-en",
    "referenceReviewDate": "2026-04-28",
    "technicalReviewerId": "team-evals",
    "technicalReviewDate": "2026-04-28",
    "notes": "Holdout seed for reverse preservation; human-reviewed reference not produced by evaluated model families."
  }
}
