{
  "split": "targeted",
  "category": "plain",
  "sourceLanguage": "es",
  "targetLanguage": "en",
  "contentType": "text",
  "source": {
    "text": "Aún no hay páginas traducidas. Empieza con el panel."
  },
  "references": [
    {
      "quality": "primary",
      "text": "No pages have been translated yet. Start with the dashboard.",
      "notes": "First-party dev reference for reverse plain smoke coverage."
    }
  ],
  "checks": {
    "sourceShouldChange": true,
    "expectedPatterns": ["(?i)\\b(pages|translated|dashboard)\\b"]
  },
  "provenance": {
    "sourceClass": "first_party_authored",
    "authorId": "team-evals",
    "createdAt": "2026-04-28",
    "sourceOrigin": "private-eval-spec BF-EVAL-TXT-004",
    "derivedFrom": null,
    "publicExposure": "private",
    "reviewStatus": "technical_reviewed",
    "referenceTranslatorId": "evals-translator-en",
    "referenceReviewerId": "evals-reviewer-en",
    "referenceReviewDate": "2026-04-28",
    "technicalReviewerId": "team-evals",
    "technicalReviewDate": "2026-04-28",
    "notes": "Dev reverse plain case authored for phase-1 basics coverage."
  }
}
